{
  "definitions": {},
  "$schema": "http://json-schema.org/draft-07/schema#",
  "title": "Root",
  "type": "object",
  "required": [
    "responseCode",
    "message",
    "errors",
    "data"
  ],
  "properties": {
    "responseCode": {
      "title": "Responsecode",
      "type": "integer",
      "default": 200
    },
    "message": {
      "title": "Message",
      "type": "null",
      "default": null
    },
    "errors": {
      "title": "Errors",
      "type": "null",
      "default": null
    },
    "data": {
      "title": "Data",
      "type": "array",
      "default": [],
      "items":{
        "title": "Items",
        "type": "object",
        "required": [
          "id",
          "name",
          "region",
          "statusLabel"
        ],
        "properties": {
          "id": {
            "title": "Id",
            "type": "string",
            "default": "",
            "pattern": "^.*$"
          },
          "name": {
            "title": "Name",
            "type": ["null","string"],
            "default": "",
            "pattern": "^.*$"
          },
          "region": {
            "title": "Region",
            "type": "null",
            "default": null
          },
          "statusLabel": {
            "title": "Statuslabel",
            "type": "null",
            "default": null
          }
        }
      }

    }
  }
}
